Sheet: 附件2
A1: 附件${gsnum}:
A2: ${projectName}投资估算表
A3: 序号 | B3: 工程项目名称 | C3: 单位 | D3: 工程量 | E3: 综合单价 (元) | F3: 合计 (万元) | G3: 备注
A4: 一 | B4: 工程建设费
A8: 二 | B8: 工程建设其他费 | C8: 计费依据及标准
A12: 三 | B12: 预备费
A13: 1 | B13: 基本预备费
A14: 四 | B14: 合计

Sheet: Sheet2
A1: 深圳港西部政府码头（战备码头）——生产用房
A2: 序号 | B2: 工程项目名称 | C2: 面积 （m2) | D2: 报送概算 （万元） | E2: 报送单位造价 （元/m2) | F2: 报审单价 （元/m2） | G2: 审核概算 (万元) | H2: 审核单位造价 （元/m2) | I2: 审核单价 （元/m2）
A3: （一） | B3: 建筑工程 | C3: 1900 | D3: 1112.6199999999999 | E3: =RC[-1]*10000/RC[-2] -> 5855.8947368421041 | G3: 704.7 | H3: =RC[-1]*10000/RC[-5] -> 3708.9473684210525
A4: 1 | B4: 地下桩基工程 | C4: 1900 | D4: =636.83*1.1 -> 700.51300000000015 | E4: =RC[-1]*10000/RC[-2] -> 3686.9105263157903 | F4: 3700 | G4: =R[-1]C-R[1]C-R[2]C -> 354.63600000000008 | H4: =RC[-1]*10000/RC[-5] -> 1866.5052631578951 | I4: 1850
A5: 2 | B5: 地上建筑工程 | C5: 1900 | D5: =R[-2]C-R[-1]C-R[1]C -> 226.10699999999974 | E5: =RC[-1]*10000/RC[-2] -> 1190.0368421052617 | F5: 1200 | G5: =172.72*1.2 -> 207.26399999999998 | H5: =RC[-1]*10000/RC[-5] -> 1090.8631578947368 | I5: 1100
A6: 3 | B6: 外墙装饰工程 | C6: 1900 | D6: =124*1.5 -> 186 | E6: =RC[-1]*10000/RC[-2] -> 978.9473684210526 | F6: 950 | G6: =119*1.2 -> 142.79999999999998 | H6: =RC[-1]*10000/RC[-5] -> 751.57894736842093 | I6: 750
A8: （二） | B8: 室内装饰工程 | C8: 1900 | D8: 191.64 | E8: =RC[-1]*10000/RC[-2] -> 1008.6315789473683 | G8: 150.4 | H8: =RC[-1]*10000/RC[-5] -> 791.57894736842104
C9: 面积 （m2) | D9: 楼（地）面单价（元/m2） | E9: 审核单价 （元/m2） | F9: 墙面单价 （元/m2） | G9: 审核单价 （元/m2） | H9: 天棚单价 （元/m2） | I9: 审核单价 （元/m2）
A10: 1 | B10: 中庭 | C10: 246.64 | D10: 430 | E10: 260 | F10: =570*2.8 -> 1596 | G10: =273*2.8 -> 764.4 | H10: 630 | I10: 480 | J10: =(RC[-6]+RC[-4]+RC[-2])*1.1 -> 2921.6000000000004 | K10: =(RC[-6]+RC[-4]+RC[-2])*1.1 -> 1654.8400000000001
A11: 2 | B11: 小办公室两间 | C11: 58.82 | D11: 305 | E11: 265 | F11: =111*2.8 -> 310.79999999999995 | G11: =R[3]C -> 224 | H11: 107 | I11: 95 | J11: =(RC[-6]+RC[-4]+RC[-2])*1.1 -> 795.08 | K11: =(RC[-6]+RC[-4]+RC[-2])*1.1 -> 642.40000000000009
A12: 3 | B12: 会议室一间 | C12: 88.04 | D12: 202 | E12: 230 | F12: =190*2.8 -> 532 | G12: =215*2.8 -> 602 | H12: 107 | I12: 95 | J12: =(RC[-6]+RC[-4]+RC[-2])*1.1 -> 925.1 | K12: =(RC[-6]+RC[-4]+RC[-2])*1.1 -> 1019.7
A13: 4 | B13: 卫生间、厨房、食品库 | C13: =146.92+R[-2]C -> 205.73999999999998 | D13: 220 | E13: 240 | F13: =132*2.8 -> 369.59999999999997 | G13: =153*2.8 -> 428.4 | H13: 112 | I13: 142 | J13: =(RC[-6]+RC[-4]+RC[-2])*1.1 -> 771.76 | K13: =(RC[-6]+RC[-4]+RC[-2])*1.1 -> 891.44
A14: 5 | B14: 财务室、档案室 | C14: =25.3*2 -> 50.6 | D14: 200 | E14: 255 | F14: =111*2.8 -> 310.79999999999995 | G14: =80*2.8 -> 224 | H14: =R[-2]C -> 107 | I14: 95 | J14: =(RC[-6]+RC[-4]+RC[-2])*1.1 -> 679.58 | K14: =(RC[-6]+RC[-4]+RC[-2])*1.1 -> 631.40000000000009
A15: 6 | B15: 设备室 | C15: 57.38 | D15: 125 | E15: 85 | F15: =48.27*2.8 -> 135.15600000000001 | G15: =60*2.8 -> 168 | H15: =R[-2]C -> 112 | I15: =R[-2]C -> 142 | J15: =(RC[-6]+RC[-4]+RC[-2])*1.1 -> 409.37160000000006 | K15: =(RC[-6]+RC[-4]+RC[-2])*1.1 -> 434.50000000000006
A16: 7 | B16: 餐厅 | C16: 98.97 | D16: 592 | E16: 330 | F16: =111*2.8 -> 310.79999999999995 | G16: =R[-2]C -> 224 | H16: =R[-5]C -> 107 | I16: 95 | J16: =(RC[-6]+RC[-4]+RC[-2])*1.1 -> 1110.78 | K16: =(RC[-6]+RC[-4]+RC[-2])*1.1 -> 713.90000000000009

Sheet: Sheet3
A1: 深圳港西部政府码头（战备码头）——生产用房
A2: 楼层 | B2: 房间功能名称 | C2: 面积 （m2) | D2: 地面 | I2: 单位造价 （元/m2） | J2: 备注
B3: 中庭 | C3: 246.64 | D3: 430.74 | E3: 594141.97 | F3: 120412.06 | I3: =RC[-5]+SUM(RC[-4]:RC[-1])/RC[-6] -> 3327.8938679857283
B4: 阳台 | C4: 12.63 | D4: 275.58 | I4: =RC[-5]+SUM(RC[-4]:RC[-1])/RC[-6] -> 275.58
B5: 餐厅 | C5: 98.97 | D5: 592.30999999999995 | I5: =RC[-5]+SUM(RC[-4]:RC[-1])/RC[-6] -> 592.30999999999995
B6: 楼梯间 | C6: 68.02 | D6: 592.30999999999995 | I6: =RC[-5]+SUM(RC[-4]:RC[-1])/RC[-6] -> 592.30999999999995
B7: 厨房 | C7: 111.8 | D7: 220.6 | E7: =RC[-2]/(RC[-2]+R[1]C[-2])*94439.52 -> 71864.540811325889 | I7: =RC[-5]+SUM(RC[-4]:RC[-1])/RC[-6] -> 863.39553498502585
B8: 卫生间 | C8: =146.92-R[-1]C -> 35.11999999999999 | D8: 220.6 | E8: =RC[-2]/(R[-1]C[-2]+RC[-2])*94439.52 -> 22574.979188674104 | I8: =RC[-5]+SUM(RC[-4]:RC[-1])/RC[-6] -> 863.39553498502596
B9: 食品库 | C9: 56.19 | D9: 220.6 | E9: 10162.34 | I9: =RC[-5]+SUM(RC[-4]:RC[-1])/RC[-6] -> 401.45673607403455
B10: 楼梯间 | C10: 190.93 | D10: 312.87 | I10: =RC[-5]+SUM(RC[-4]:RC[-1])/RC[-6] -> 312.87
B11: 财务室 | C11: 25.3 | D11: 312.87 | I11: =RC[-5]+SUM(RC[-4]:RC[-1])/RC[-6] -> 312.87
B12: 卫生间 | C12: 103.98 | D12: 151.97999999999999 | I12: =RC[-5]+SUM(RC[-4]:RC[-1])/RC[-6] -> 151.97999999999999
B13: 茶水间 | C13: 15.41 | D13: 125.14 | I13: =RC[-5]+SUM(RC[-4]:RC[-1])/RC[-6] -> 125.14
B14: 走廊 | C14: 372.92 | D14: 202.09 | I14: =RC[-5]+SUM(RC[-4]:RC[-1])/RC[-6] -> 202.09
B15: 大、中会议室 | C15: 88.04 | D15: 202.09 | E15: 23117.48 | I15: =RC[-5]+SUM(RC[-4]:RC[-1])/RC[-6] -> 464.66928214447978
B16: 装修 | C16: 212.03 | I16: =RC[-5]+SUM(RC[-4]:RC[-1])/RC[-6] -> 0
B17: 电气 | C17: 42.88 | I17: =RC[-5]+SUM(RC[-4]:RC[-1])/RC[-6] -> 0
B18: 小办公室 | C18: 58.82 | D18: 305.25 | I18: =RC[-5]+SUM(RC[-4]:RC[-1])/RC[-6] -> 305.25
B19: 文体活动室 | C19: 130.54 | D19: 202.09 | I19: =RC[-5]+SUM(RC[-4]:RC[-1])/RC[-6] -> 202.09
B20: 设备室 | C20: 57.38 | D20: 125.14 | I20: =RC[-5]+SUM(RC[-4]:RC[-1])/RC[-6] -> 125.14
B21: 消防控制室 | C21: 14.89 | D21: 125.14 | I21: =RC[-5]+SUM(RC[-4]:RC[-1])/RC[-6] -> 125.14
B22: 工人冲凉房 | C22: 142.29 | I22: =RC[-5]+SUM(RC[-4]:RC[-1])/RC[-6] -> 0

Sheet: 审核表
A1: 深圳港西部政府码头（战备码头）——生产用房
A2: 序号 | B2: 工程项目名称 | C2: 面积 （m2) | D2: 报送概算 （万元） | E2: 报送单位造价 （元/m2) | F2: 审核概算 (万元) | G2: 审核单位造价 （元/m2)
A3: （一） | B3: 建筑工程 | C3: 1900 | D3: 1112.6199999999999 | E3: 5855 | F3: 704.7 | G3: 3700
A4: 1 | B4: 地下桩基工程 | C4: 1900 | D4: =636.83*1.1 -> 700.51300000000015 | E4: 3700 | F4: =R[-1]C-R[1]C-R[2]C -> 354.63600000000008 | G4: 900
A5: 2 | B5: 地上建筑工程 | C5: 1900 | D5: =R[-2]C-R[-1]C-R[1]C -> 226.10699999999974 | E5: 1200 | F5: =172.72*1.2 -> 207.26399999999998 | G5: 1100
A6: 3 | B6: 外墙装饰工程 | C6: 1900 | D6: =124*1.5 -> 186 | E6: 950 | F6: =119*1.2 -> 142.79999999999998 | G6: 750
A7: （二） | B7: 室内装饰工程 | C7: 1900 | D7: 191.64 | E7: 1000 | F7: 149.5 | G7: 790
A8: （三） | B8: 安装工程 | C8: 1900 | D8: 164.03 | E8: 900
A9: 深圳港西部政府码头（战备码头）——生产用房室内装修工程
A10: 序号 | B10: 房间名称 | C10: 面积 （m2) | D10: 楼（地）面单价（元/m2） | E10: 审核单价 （元/m2） | F10: 墙面单价 （元/m2） | G10: 审核单价 （元/m2） | H10: 天棚单价 （元/m2） | I10: 审核单价 （元/m2） | J10: 报审单价 | K10: 审核单价
A11: 1 | B11: 中庭 | C11: 246.64 | D11: 430 | E11: 260 | F11: 1600 | G11: 760 | H11: 630 | I11: 480 | J11: 3000 | K11: 1650
A12: 2 | B12: 小办公室两间 | C12: 58.82 | D12: 305 | E12: 265 | F12: 310 | G12: =R[3]C -> 220 | H12: 110 | I12: 95 | J12: 800 | K12: 650
A13: 3 | B13: 会议室一间 | C13: 88.04 | D13: 200 | E13: 220 | F13: 530 | G13: 600 | H13: 110 | I13: 95 | J13: 950 | K13: 1000
A14: 4 | B14: 卫生间、厨房、食品库 | C14: =146.92+R[-2]C -> 205.73999999999998 | D14: 220 | E14: 240 | F14: 370 | G14: 430 | H14: 110 | I14: 140 | J14: 770 | K14: 900
A15: 5 | B15: 财务室、档案室 | C15: =25.3*2 -> 50.6 | D15: 200 | E15: 255 | F15: 310 | G15: 220 | H15: =R[-2]C -> 110 | I15: 95 | J15: 680 | K15: 630
A16: 6 | B16: 设备室 | C16: 57.38 | D16: 125 | E16: 85 | F16: 135 | G16: 170 | H16: 110 | I16: =R[-2]C -> 140 | J16: 420 | K16: 440
A17: 7 | B17: 餐厅 | C17: 98.97 | D17: 590 | E17: 330 | F17: 310 | G17: =R[-2]C -> 220 | H17: =R[-5]C -> 110 | I17: 95 | J17: 1100 | K17: 700

Sheet: 兼容性报表
B1: 概算汇总表、审核对比表.xls 兼容性报表
B2: 运行环境: 2013-11-28 16:49
B4: 因为 Excel 2007 之前的 Excel 版本不支持此工作簿中的某些功能，如果以此格式保存，则这些功能将丢失或降级。
B6: 轻微保真损失 | E6: 发生次数
B8: 所选文件格式不支持此工作簿中某些单元格或样式包含的格式。这些格式将被转换为最相近的可用格式。 | E8: 1